{
  "version": 1,
  "generated_at": "2026-06-05T20:13:18Z",
  "repo_root": "/home/mrohr/appsec-advisor/tests/fixtures/e2e/synthetic-repo",
  "rules_evaluated": [
    {
      "rule_id": "ARCH-COOKIE-001",
      "title": "Insecure cookie / session hardening",
      "status": "not_applicable",
      "applies": false,
      "confidence": "low",
      "control": "Session Cookie Hardening",
      "domain": "SessionMgmt",
      "evidence": [],
      "skip_reason": "no precondition signal in repo",
      "decision": "no_action",
      "architectural_theme": "SessionDesign",
      "generic_threat_title": "Session token theft through weak cookie hardening"
    },
    {
      "rule_id": "ARCH-CORS-001",
      "title": "CORS wildcard origin combined with credentials",
      "status": "not_applicable",
      "applies": false,
      "confidence": "low",
      "control": "CORS Policy",
      "domain": "FrontendSec",
      "evidence": [],
      "skip_reason": "no precondition signal in repo",
      "decision": "no_action",
      "architectural_theme": "SecureDefaults",
      "generic_threat_title": "Cross-origin request abuse through permissive CORS"
    },
    {
      "rule_id": "ARCH-JWT-001",
      "title": "Weak JWT algorithm / missing algorithm whitelist",
      "status": "not_applicable",
      "applies": false,
      "confidence": "low",
      "control": "JWT Algorithm Whitelist",
      "domain": "IAM",
      "evidence": [],
      "skip_reason": "no precondition signal in repo",
      "decision": "no_action",
      "architectural_theme": "Authentication",
      "generic_threat_title": "Account impersonation through weak JWT verification"
    },
    {
      "rule_id": "ARCH-TLS-001",
      "title": "Cleartext transport or disabled DB-TLS",
      "status": "not_applicable",
      "applies": false,
      "confidence": "low",
      "control": "Transport Encryption",
      "domain": "DataProt",
      "evidence": [],
      "skip_reason": "no precondition signal in repo",
      "decision": "no_action",
      "architectural_theme": "DataProtection",
      "generic_threat_title": "Data disclosure through cleartext transport"
    },
    {
      "rule_id": "ARCH-MGMT-001",
      "title": "Management / debug / metrics endpoint exposed without authn/authz signal",
      "status": "not_applicable",
      "applies": false,
      "confidence": "low",
      "control": "Management Endpoint Protection",
      "domain": "AuthZ",
      "evidence": [],
      "skip_reason": "no management surface in route inventory",
      "decision": "no_action",
      "architectural_theme": "Authorization",
      "generic_threat_title": "Privilege abuse through inconsistent authorization"
    },
    {
      "rule_id": "ARCH-XSS-001",
      "title": "XSS exposure from weak output encoding",
      "status": "not_applicable",
      "applies": false,
      "confidence": "low",
      "control": "Output Encoding / Templating Autoescape",
      "domain": "FrontendSec",
      "evidence": [],
      "skip_reason": "no precondition signal in repo",
      "decision": "no_action",
      "architectural_theme": "InputValidation",
      "generic_threat_title": "Cross-site scripting through missing centralized output encoding"
    },
    {
      "rule_id": "ARCH-SQLI-001",
      "title": "SQL injection exposure from ad-hoc SQL construction",
      "status": "not_applicable",
      "applies": false,
      "confidence": "low",
      "control": "Parameterized Database Access",
      "domain": "InputVal",
      "evidence": [],
      "skip_reason": "no precondition signal in repo",
      "decision": "no_action",
      "architectural_theme": "InputValidation",
      "generic_threat_title": "Injection through missing centralized input validation"
    },
    {
      "rule_id": "ARCH-AUTHZ-001",
      "title": "Broken Access Control exposure from inconsistent AuthZ",
      "status": "not_applicable",
      "applies": false,
      "confidence": "low",
      "control": "Centralised Authorization Policy",
      "domain": "AuthZ",
      "evidence": [],
      "skip_reason": "no authenticated routes \u2014 precondition not met",
      "decision": "no_action",
      "architectural_theme": "Authorization",
      "generic_threat_title": "Privilege abuse through inconsistent authorization"
    },
    {
      "rule_id": "ARCH-INPUT-001",
      "title": "Broken input validation exposure",
      "status": "not_applicable",
      "applies": false,
      "confidence": "low",
      "control": "Schema / Allowlist Input Validation",
      "domain": "InputVal",
      "evidence": [],
      "skip_reason": "no precondition signal in repo",
      "decision": "no_action",
      "architectural_theme": "InputValidation",
      "generic_threat_title": "Injection through missing centralized input validation"
    }
  ],
  "control_assessments": [],
  "threat_hypotheses": [],
  "anti_pattern_candidates": [],
  "warnings": []
}
